[
  {
    "id": "animals-cat",
    "word": "cat",
    "translation": "貓",
    "emoji": "🐱",
    "category": "Animals",
    "image": "https://raw.githubusercontent.com/qpooqp889/little-word-garden/main/assets/vocab-cat.png",
    "imagePosition": "50% 50%",
    "imageAlt": "A friendly cat",
    "englishAudio": null,
    "chineseAudio": null,
    "speech": {
      "englishLocale": "en-US",
      "chineseLocale": "zh-TW"
    }
  },
  {
    "id": "animals-dog",
    "word": "dog",
    "translation": "狗",
    "emoji": "🐶",
    "category": "Animals",
    "image": null,
    "imagePosition": "50% 50%",
    "imageAlt": "A friendly dog",
    "englishAudio": null,
    "chineseAudio": null,
    "speech": {
      "englishLocale": "en-US",
      "chineseLocale": "zh-TW"
    }
  },
  {
    "id": "animals-rabbit",
    "word": "rabbit",
    "translation": "兔子",
    "emoji": "🐰",
    "category": "Animals",
    "image": null,
    "imagePosition": "50% 50%",
    "imageAlt": "A friendly rabbit",
    "englishAudio": null,
    "chineseAudio": null,
    "speech": {
      "englishLocale": "en-US",
      "chineseLocale": "zh-TW"
    }
  },
  {
    "id": "animals-elephant",
    "word": "elephant",
    "translation": "大象",
    "emoji": "🐘",
    "category": "Animals",
    "image": null,
    "imagePosition": "50% 50%",
    "imageAlt": "A friendly elephant",
    "englishAudio": null,
    "chineseAudio": null,
    "speech": {
      "englishLocale": "en-US",
      "chineseLocale": "zh-TW"
    }
  },
  {
    "id": "animals-fish",
    "word": "fish",
    "translation": "魚",
    "emoji": "🐟",
    "category": "Animals",
    "image": null,
    "imagePosition": "50% 50%",
    "imageAlt": "A friendly fish",
    "englishAudio": null,
    "chineseAudio": null,
    "speech": {
      "englishLocale": "en-US",
      "chineseLocale": "zh-TW"
    }
  },
  {
    "id": "animals-bird",
    "word": "bird",
    "translation": "小鳥",
    "emoji": "🐦",
    "category": "Animals",
    "image": null,
    "imagePosition": "50% 50%",
    "imageAlt": "A friendly bird",
    "englishAudio": null,
    "chineseAudio": null,
    "speech": {
      "englishLocale": "en-US",
      "chineseLocale": "zh-TW"
    }
  },
  {
    "id": "animals-turtle",
    "word": "turtle",
    "translation": "烏龜",
    "emoji": "🐢",
    "category": "Animals",
    "image": null,
    "imagePosition": "50% 50%",
    "imageAlt": "A friendly turtle",
    "englishAudio": null,
    "chineseAudio": null,
    "speech": {
      "englishLocale": "en-US",
      "chineseLocale": "zh-TW"
    }
  },
  {
    "id": "food-apple",
    "word": "apple",
    "translation": "蘋果",
    "emoji": "🍎",
    "category": "Food",
    "image": "https://raw.githubusercontent.com/qpooqp889/little-word-garden/main/assets/vocab-apple.png",
    "imagePosition": "50% 50%",
    "imageAlt": "A red apple",
    "englishAudio": null,
    "chineseAudio": null,
    "speech": {
      "englishLocale": "en-US",
      "chineseLocale": "zh-TW"
    }
  },
  {
    "id": "food-orange",
    "word": "orange",
    "translation": "橘子",
    "emoji": "🍊",
    "category": "Food",
    "image": null,
    "imagePosition": "50% 50%",
    "imageAlt": "An orange fruit",
    "englishAudio": null,
    "chineseAudio": null,
    "speech": {
      "englishLocale": "en-US",
      "chineseLocale": "zh-TW"
    }
  },
  {
    "id": "food-strawberry",
    "word": "strawberry",
    "translation": "草莓",
    "emoji": "🍓",
    "category": "Food",
    "image": null,
    "imagePosition": "50% 50%",
    "imageAlt": "A red strawberry",
    "englishAudio": null,
    "chineseAudio": null,
    "speech": {
      "englishLocale": "en-US",
      "chineseLocale": "zh-TW"
    }
  },
  {
    "id": "food-grape",
    "word": "grape",
    "translation": "葡萄",
    "emoji": "🍇",
    "category": "Food",
    "image": null,
    "imagePosition": "50% 50%",
    "imageAlt": "A bunch of grapes",
    "englishAudio": null,
    "chineseAudio": null,
    "speech": {
      "englishLocale": "en-US",
      "chineseLocale": "zh-TW"
    }
  },
  {
    "id": "food-bread",
    "word": "bread",
    "translation": "麵包",
    "emoji": "🍞",
    "category": "Food",
    "image": null,
    "imagePosition": "50% 50%",
    "imageAlt": "A slice of bread",
    "englishAudio": null,
    "chineseAudio": null,
    "speech": {
      "englishLocale": "en-US",
      "chineseLocale": "zh-TW"
    }
  },
  {
    "id": "food-milk",
    "word": "milk",
    "translation": "牛奶",
    "emoji": "🥛",
    "category": "Food",
    "image": null,
    "imagePosition": "50% 50%",
    "imageAlt": "A glass of milk",
    "englishAudio": null,
    "chineseAudio": null,
    "speech": {
      "englishLocale": "en-US",
      "chineseLocale": "zh-TW"
    }
  },
  {
    "id": "food-cake",
    "word": "cake",
    "translation": "蛋糕",
    "emoji": "🍰",
    "category": "Food",
    "image": null,
    "imagePosition": "50% 50%",
    "imageAlt": "A slice of cake",
    "englishAudio": null,
    "chineseAudio": null,
    "speech": {
      "englishLocale": "en-US",
      "chineseLocale": "zh-TW"
    }
  },
  {
    "id": "transport-car",
    "word": "car",
    "translation": "汽車",
    "emoji": "🚗",
    "category": "Transport",
    "image": null,
    "imagePosition": "50% 50%",
    "imageAlt": "A small red car",
    "englishAudio": null,
    "chineseAudio": null,
    "speech": {
      "englishLocale": "en-US",
      "chineseLocale": "zh-TW"
    }
  },
  {
    "id": "transport-bus",
    "word": "bus",
    "translation": "公車",
    "emoji": "🚌",
    "category": "Transport",
    "image": "https://raw.githubusercontent.com/qpooqp889/little-word-garden/main/assets/vocab-bus.png",
    "imagePosition": "50% 50%",
    "imageAlt": "A yellow bus",
    "englishAudio": null,
    "chineseAudio": null,
    "speech": {
      "englishLocale": "en-US",
      "chineseLocale": "zh-TW"
    }
  },
  {
    "id": "transport-airplane",
    "word": "airplane",
    "translation": "飛機",
    "emoji": "✈️",
    "category": "Transport",
    "image": null,
    "imagePosition": "50% 50%",
    "imageAlt": "A little airplane",
    "englishAudio": null,
    "chineseAudio": null,
    "speech": {
      "englishLocale": "en-US",
      "chineseLocale": "zh-TW"
    }
  },
  {
    "id": "transport-bicycle",
    "word": "bicycle",
    "translation": "腳踏車",
    "emoji": "🚲",
    "category": "Transport",
    "image": null,
    "imagePosition": "50% 50%",
    "imageAlt": "A bicycle",
    "englishAudio": null,
    "chineseAudio": null,
    "speech": {
      "englishLocale": "en-US",
      "chineseLocale": "zh-TW"
    }
  },
  {
    "id": "transport-rocket",
    "word": "rocket",
    "translation": "火箭",
    "emoji": "🚀",
    "category": "Transport",
    "image": null,
    "imagePosition": "50% 50%",
    "imageAlt": "A rocket",
    "englishAudio": null,
    "chineseAudio": null,
    "speech": {
      "englishLocale": "en-US",
      "chineseLocale": "zh-TW"
    }
  },
  {
    "id": "transport-taxi",
    "word": "taxi",
    "translation": "計程車",
    "emoji": "🚕",
    "category": "Transport",
    "image": null,
    "imagePosition": "50% 50%",
    "imageAlt": "A taxi",
    "englishAudio": null,
    "chineseAudio": null,
    "speech": {
      "englishLocale": "en-US",
      "chineseLocale": "zh-TW"
    }
  },
  {
    "id": "transport-truck",
    "word": "truck",
    "translation": "卡車",
    "emoji": "🚚",
    "category": "Transport",
    "image": null,
    "imagePosition": "50% 50%",
    "imageAlt": "A delivery truck",
    "englishAudio": null,
    "chineseAudio": null,
    "speech": {
      "englishLocale": "en-US",
      "chineseLocale": "zh-TW"
    }
  },
  {
    "id": "transport-helicopter",
    "word": "helicopter",
    "translation": "直升機",
    "emoji": "🚁",
    "category": "Transport",
    "image": null,
    "imagePosition": "50% 50%",
    "imageAlt": "A helicopter",
    "englishAudio": null,
    "chineseAudio": null,
    "speech": {
      "englishLocale": "en-US",
      "chineseLocale": "zh-TW"
    }
  },
  {
    "id": "nature-sun",
    "word": "sun",
    "translation": "太陽",
    "emoji": "☀️",
    "category": "Nature & Home",
    "image": "https://raw.githubusercontent.com/qpooqp889/little-word-garden/main/assets/vocab-sun.png",
    "imagePosition": "50% 50%",
    "imageAlt": "A bright sun",
    "englishAudio": null,
    "chineseAudio": null,
    "speech": {
      "englishLocale": "en-US",
      "chineseLocale": "zh-TW"
    }
  },
  {
    "id": "nature-moon",
    "word": "moon",
    "translation": "月亮",
    "emoji": "🌙",
    "category": "Nature & Home",
    "image": null,
    "imagePosition": "50% 50%",
    "imageAlt": "A crescent moon",
    "englishAudio": null,
    "chineseAudio": null,
    "speech": {
      "englishLocale": "en-US",
      "chineseLocale": "zh-TW"
    }
  },
  {
    "id": "nature-star",
    "word": "starlight",
    "translation": "星光",
    "emoji": "⭐",
    "category": "Nature & Home",
    "image": null,
    "imagePosition": "50% 50%",
    "imageAlt": "Soft starlight",
    "englishAudio": null,
    "chineseAudio": null,
    "speech": {
      "englishLocale": "en-US",
      "chineseLocale": "zh-TW"
    }
  },
  {
    "id": "nature-cloud",
    "word": "cloud",
    "translation": "雲",
    "emoji": "☁️",
    "category": "Nature & Home",
    "image": null,
    "imagePosition": "50% 50%",
    "imageAlt": "A fluffy cloud",
    "englishAudio": null,
    "chineseAudio": null,
    "speech": {
      "englishLocale": "en-US",
      "chineseLocale": "zh-TW"
    }
  },
  {
    "id": "nature-rain",
    "word": "rain",
    "translation": "雨",
    "emoji": "🌧️",
    "category": "Nature & Home",
    "image": null,
    "imagePosition": "50% 50%",
    "imageAlt": "A rainy cloud",
    "englishAudio": null,
    "chineseAudio": null,
    "speech": {
      "englishLocale": "en-US",
      "chineseLocale": "zh-TW"
    }
  },
  {
    "id": "nature-tree",
    "word": "tree",
    "translation": "樹",
    "emoji": "🌳",
    "category": "Nature & Home",
    "image": null,
    "imagePosition": "50% 50%",